Name_lang,SourceText_lang,Description_lang,ID,MountTypeID,Flags,SourceTypeEnum,SourceSpellID,PlayerConditionID,MountFlyRideHeight,UiModelSceneID,MountSpecialRiderAnimKitID,MountSpecialSpellVisualKitID
Ice Mammoth,|cFFFFD200Vendor: |rLillehoff|n|cFFFFD200Zone: |rThe Storm Peaks|n|cFFFFD200Faction: |rThe Sons of Hodir - Revered|n|cFFFFD200Cost: |r1000|TINTERFACE\MONEYFRAME\UI-GOLDICON.BLP:0|t,The Sons of Hodir believe that riding an ice-white mammoth will protect the rider from frostbite and snow blindness.,258,230,4,2,59797,0,0,45,0,0
Ice Mammoth,|cFFFFD200Vendor: |rLillehoff|n|cFFFFD200Zone: |rThe Storm Peaks|n|cFFFFD200Faction: |rThe Sons of Hodir - Revered|n|cFFFFD200Cost: |r1000|TINTERFACE\MONEYFRAME\UI-GOLDICON.BLP:0|t,Many ice giants claim that they have trained their favored white mammoths to trigger avalanches with their trumpeting calls.,259,230,4,2,59799,0,0,45,0,0
Red Proto-Drake,|cFFFFD200Achievement: |rGlory of the Hero|n|cFFFFD200Category: |rDungeons & Raids,"The vrykul were the first to recognize their potential. Or maybe the second, depending on how you look at it.",262,248,128,5,59961,0,0,44,0,0
Black Proto-Drake,|cFFFFD200Legacy|r,Bred specifically to honor those heroes who showed exceptional resilience and fortitude facing the dangers in Northrend.,263,248,192,2,59976,0,0,44,0,0
Blue Proto-Drake,|cFFFFD200Drop: |rSkadi the Ruthless|n|cFFFFD200Zone: |rUtgarde Pinnacle,The Storm Peaks! There we will find the beast strong enough to bear me into battle. -Skadi the Ruthless,264,248,128,0,59996,0,0,44,0,0
Time-Lost Proto-Drake,|cFFFFD200Drop: |rTime-Lost Proto-Drake|n|cFFFFD200Zone: |rThe Storm Peaks,The only reason for time is so that everything doesn't happen at once.,265,248,128,0,60002,0,0,44,0,0
Plagued Proto-Drake,|cFFFFD200Legacy|r,Bred specifically to honor those heroes who showed significant courage and persistence facing the dangers in Northrend.,266,248,192,5,60021,0,0,44,0,0
Violet Proto-Drake,"|cFFFFD200Achievement: |rWhat a Long, Strange Trip It's Been|n|cFFFFD200Category: |rWorld Events",I cannot help but wonder if things would have turned out different if the titans had elevated even one more dragonflight. -Alexstrasza,267,248,128,5,60024,0,0,44,0,0
Albino Drake,|cFFFFD200Achievement: |rLeading the Cavalry|n|cFFFFD200Category: |rGeneral,Even the Draconic Native Association tests proved inconclusive in determining if the albino drake is related to a known dragonflight. -Breanni,268,248,128,5,60025,0,0,4,0,0
Armored Brown Bear,|cFFFFD200Vendor: |rMei Francis|n|cFFFFD200Zone: |rCrystalsong Forest|n|cFFFFD200Cost: |r750|TINTERFACE\MONEYFRAME\UI-GOLDICON.BLP:0|t,"This ursine mount's swiftness is enhanced by its heavy armor, imbued with magic from Kirin Tor magi.",269,230,4,2,60114,0,0,4,0,0
Armored Brown Bear,|cFFFFD200Vendor: |rMei Francis|n|cFFFFD200Zone: |rCrystalsong Forest|n|cFFFFD200Cost: |r750|TINTERFACE\MONEYFRAME\UI-GOLDICON.BLP:0|t,"Your cries of ""For the Horde!"" will be much more menacing from atop a heavily armored bear that's barreling down on Alliance at top speed.",270,230,4,2,60116,0,0,4,0,0
Black War Bear,|cFFFFD200Achievement: |rFor The Alliance!|n|cFFFFD200Category: |rPlayer vs. Player,"Killing leaders of the Horde is its own reward, but this intimidating beast is an excellent memento.",271,230,4,5,60118,0,0,4,0,0
Black War Bear,|cFFFFD200Achievement: |rFor The Horde!|n|cFFFFD200Category: |rPlayer vs. Player,"This formidable mount is bought with the blood of Alliance leaders, but you would have killed them for free.",272,230,4,5,60119,0,0,4,0,0
Grand Caravan Mammoth,|cFFFFD200Legacy|r,"Merchants trust only this thundering, mountainous steed to protect them when venturing down Azeroth's most dangerous trade routes.",273,230,64,2,60136,0,0,45,0,0
Grand Caravan Mammoth,|cFFFFD200Legacy|r,"A common sight on trade routes all across Azeroth, this calm, stalwart mount is the favorite of merchants traveling to exotic and distant markets.",274,230,64,2,60140,0,0,45,0,0
Mekgineer's Chopper,|cFFFFD200Profession: |rEngineering,"Sporting superb engineering craftsmanship, this chopper is one of the few personal vehicles on Azeroth built for two.",275,230,4,3,60424,0,0,4,0,0
Armored Snowy Gryphon,|cFFFFD200Vendor: |rMei Francis|n|cFFFFD200Zone: |rCrystalsong Forest|n|cFFFFD200Cost: |r2000|TINTERFACE\MONEYFRAME\UI-GOLDICON.BLP:0|t,"The nice thing is that when they attack, blood almost never stains their feathers. -Mei Francis",276,248,132,2,61229,0,0,4,0,0
Armored Blue Wind Rider,|cFFFFD200Vendor: |rMei Francis|n|cFFFFD200Zone: |rCrystalsong Forest|n|cFFFFD200Cost: |r2000|TINTERFACE\MONEYFRAME\UI-GOLDICON.BLP:0|t,"They are not native to Northrend, but they have adapted extremely well to the cold. -Mei Francis",277,248,132,2,61230,0,0,4,0,0
Green Proto-Drake,|cFFFFD200Drop:|r Cracked Egg,"The vrykul were the first to recognize their potential. Or maybe the second, depending on how you look at it.",278,248,128,0,61294,0,0,44,0,0
Magnificent Flying Carpet,|cFFFFD200Profession: |rTailoring,Standard features include a sturdy imbued frostweave frame and real iceweb spider silk threading.  Spare head pillow sold separately.,279,248,1024,3,61309,26503,0,4,0,0
Traveler's Tundra Mammoth,|cFFFFD200Vendor: |rMei Francis|n|cFFFFD200Zone: |rCrystalsong Forest|n|cFFFFD200Cost: |r20000|TINTERFACE\MONEYFRAME\UI-GOLDICON.BLP:0|t,"Ancient manuscripts depict merchants traveling across the frozen tundra with these colossal beasts, leading scholars to believe they are the first domesticated mounts.",280,230,4,2,61425,0,0,45,0,0
Traveler's Tundra Mammoth,|cFFFFD200Vendor: |rMei Francis|n|cFFFFD200Zone: |rCrystalsong Forest|n|cFFFFD200Cost: |r20000|TINTERFACE\MONEYFRAME\UI-GOLDICON.BLP:0|t,Riders and merchants alike trust only this strong and steadfast mammoth to carry them safely across the frigid tundra.,284,230,4,2,61447,0,0,45,0,0
Flying Carpet,|cFFFFD200Profession: |rTailoring,"Hop aboard this flying carpet to see the shining, shimmering, and splendid world of Azeroth, wonder by wonder.",285,248,1024,3,61451,26503,0,4,0,0
Grand Black War Mammoth,|cFFFFD200Drop: |rBoss Drop|n|cFFFFD200Location: |rVault of Archavon,"Once used by giants to carry heavily armored warriors, these grand war mammoths can easily bear more than one rider of less-than-giant stature.",286,230,4,0,61465,0,0,45,0,0
Grand Black War Mammoth,|cFFFFD200Drop: |rBoss Drop|n|cFFFFD200Location: |rVault of Archavon,"Rarely, a war mammoth is born stronger and more tractable than its peers. These mammoths are dubbed ""grand"" and carry more than one rider to the front lines.",287,230,4,0,61467,0,0,45,0,0
Grand Ice Mammoth,|cFFFFD200Vendor: |rLillehoff|n|cFFFFD200Zone: |rThe Storm Peaks|n|cFFFFD200Faction: |rThe Sons of Hodir - Exalted|n|cFFFFD200Cost: |r10000|TINTERFACE\MONEYFRAME\UI-GOLDICON.BLP:0|t,"At home on the narrow, icy trails of the Storm Peaks, these mammoths are the only mounts the ice giants trust to carry large loads and multiple riders.",288,230,4,2,61469,0,0,45,0,0
Grand Ice Mammoth,|cFFFFD200Vendor: |rLillehoff|n|cFFFFD200Zone: |rThe Storm Peaks|n|cFFFFD200Faction: |rThe Sons of Hodir - Exalted|n|cFFFFD200Cost: |r10000|TINTERFACE\MONEYFRAME\UI-GOLDICON.BLP:0|t,"Due to high winds and avalanches, the Sons of Hodir recommend bringing at least two companions if venturing into the dangerous Storm Peaks.",289,230,4,2,61470,0,0,45,0,0
Blue Dragonhawk,|cFFFFD200Achievement: |rMountain o' Mounts|n|cFFFFD200Category: |rGeneral,"Dragonhawks are among the deadliest known predators. They are able to spot prey from great distances, rush in, and rend with both talon and beak.",291,248,132,5,61996,0,0,4,0,0
Red Dragonhawk,|cFFFFD200Achievement: |rMountain o' Mounts|n|cFFFFD200Category: |rGeneral,"Dragonhawks are among the deadliest known predators. They are able to spot prey from great distances, rush in, and rend with both talon and beak.",292,248,132,5,61997,0,0,4,0,0
Black Dragonhawk Mount,|cFFFFD200Legacy|r,This breed of dragonhawk is intensely sought after by those who have an eye for insanely rare modes of travel.,293,248,192,2,62048,0,0,4,0,0
Stormwind Steed,|cFFFFD200Vendor: |rCorporal Arthur Flew|n|cFFFFD200Zone: |rIcecrown|n|cFFFFD200Cost: |r100|TINTERFACE\ICONS\Ability_Paladin_ArtofWar.blp:0|t,"Although raised in Stormwind, this breed showed unusual aptitude for the cold weather in Icecrown.",294,230,0,2,63232,0,0,4,0,0
Darkspear Raptor,|cFFFFD200Vendor: |rSamamba|n|cFFFFD200Zone: |rIcecrown|n|cFFFFD200Cost: |r100|TINTERFACE\ICONS\Ability_Paladin_ArtofWar.blp:0|t,"This raptor breed was originally cultivated by the Drakkari, but has since been adopted by the Darkspear tribe in Northrend.",295,230,0,2,63635,0,0,4,0,0
Ironforge Ram,|cFFFFD200Vendor: |rDerrick Brindlebeard|n|cFFFFD200Zone: |rIcecrown|n|cFFFFD200Cost: |r100|TINTERFACE\ICONS\Ability_Paladin_ArtofWar.blp:0|t,Wildhammer Fact Checker claims that this specific breed was the first type of ram domesticated by the dwarves when they settled in Dun Morogh.,296,230,0,2,63636,0,0,4,0,0
Darnassian Nightsaber,|cFFFFD200Vendor: |rRook Hawkfist|n|cFFFFD200Zone: |rIcecrown|n|cFFFFD200Cost: |r100|TINTERFACE\ICONS\Ability_Paladin_ArtofWar.blp:0|t,"When a night elf's mount perishes, it is custom for the rider to keep one of the saber's great fangs as a token of remembrance.",297,230,0,2,63637,0,0,4,0,0
Gnomeregan Mechanostrider,|cFFFFD200Vendor: |rRillie Spindlenut|n|cFFFFD200Zone: |rIcecrown|n|cFFFFD200Cost: |r100|TINTERFACE\ICONS\Ability_Paladin_ArtofWar.blp:0|t,"When you absolutely, positively have to be there right now. -Rillie Spindlenut",298,230,0,2,63638,0,0,4,0,0
Exodar Elekk,|cFFFFD200Vendor: |rIrisee|n|cFFFFD200Zone: |rIcecrown|n|cFFFFD200Cost: |r100|TINTERFACE\ICONS\Ability_Paladin_ArtofWar.blp:0|t,"Exodar Elekk are elekk which have been anointed by O'ros, the Naaru who journeyed from Draenor to Azeroth with Velen and his followers.",299,230,0,2,63639,0,0,45,0,0
Orgrimmar Wolf,|cFFFFD200Vendor: |rFreka Bloodaxe|n|cFFFFD200Zone: |rIcecrown|n|cFFFFD200Cost: |r100|TINTERFACE\ICONS\Ability_Paladin_ArtofWar.blp:0|t,"For a brief time, many orcs would declare themselves ""hungry like an Orgrimmar wolf."" Some blood elves still use the phrase ironically.",300,230,0,2,63640,0,0,4,0,0
Thunder Bluff Kodo,|cFFFFD200Vendor: |rDoru Thunderhorn|n|cFFFFD200Zone: |rIcecrown|n|cFFFFD200Cost: |r100|TINTERFACE\ICONS\Ability_Paladin_ArtofWar.blp:0|t,"An alpha member of the herd, this kodo is a prime example of the mighty creatures which thunder through Mulgore.",301,230,0,2,63641,0,0,4,0,0
Silvermoon Hawkstrider,|cFFFFD200Vendor: |rTrellis Morningsun|n|cFFFFD200Zone: |rIcecrown|n|cFFFFD200Cost: |r100|TINTERFACE\ICONS\Ability_Paladin_ArtofWar.blp:0|t,"So I says I feel like chicken tonight. Next thing, I am flat out and that thing is trying to see what my eyes taste like. -Bozzle Blastbolt",302,230,0,2,63642,0,0,44,0,0
Forsaken Warhorse,|cFFFFD200Vendor: |rEliza Killian|n|cFFFFD200Zone: |rIcecrown|n|cFFFFD200Cost: |r100|TINTERFACE\ICONS\Ability_Paladin_ArtofWar.blp:0|t,"When fallen heroes are raised into undeath, so too are their horses.",303,230,0,2,63643,0,0,4,0,0
Mimiron's Head,|cFFFFD200Drop:|r Yogg-Saron|n|cFFFFD200Location:|r Ulduar,"A token of titan craftsmanship hoarded by the Old God, Yogg-Saron. Currently the single largest mechanical gnome head in Azeroth.",304,248,128,0,63796,0,0,4,0,0
Argent Hippogryph,"|cFFFFD200Vendor: |rFaction Quartermasters|n|cFFFFD200Location: |rArgent Tournament, Icecrown|n|cFFFFD200Cost: |r150|TINTERFACE\ICONS\Ability_Paladin_ArtofWar.blp:0|t|n",Argent Hippogryphs will partner with only the bravest and most battle-tested champions.,305,248,128,2,63844,0,0,4,0,0
Ironbound Proto-Drake,|cFFFFD200Achievement: |rGlory of the Ulduar Raider|n|cFFFFD200Category: |rDungeons & Raids,"His skin more hard than brass was found, that sword nor spear could pierce nor wound.",306,248,128,5,63956,0,5.5,44,0,0
Rusted Proto-Drake,|cFFFFD200Achievement: |rGlory of the Ulduar Raider|n|cFFFFD200Category: |rDungeons & Raids,"Not as shiny as the other one, but it's still a great find lads. Brann Bronzebeard",307,248,128,-1,63963,0,5.5,44,0,0
Blue Skeletal Warhorse,|cFFFFD200Legacy|r,A rare sight. Most disappeared once Baron Rivendare ruled in Stratholme.,308,230,64,2,64656,0,0,45,0,0
White Kodo,|cFFFFD200Vendor: |rHarb Clawhoof|n|cFFFFD200Zone: |rMulgore|n|cFFFFD200Cost: |r1|TINTERFACE\MONEYFRAME\UI-GOLDICON.BLP:0|t,"""The kodo is the backbone of our people. Wherever the Horde goes - in trade, settlement, or war - there you will find the mighty kodo."" - Harb Clawhoof",309,230,0,2,64657,0,0,4,0,0
Black Wolf,|cFFFFD200Vendor: |rWorld Vendors|n|cFFFFD200Cost: |r1|TINTERFACE\MONEYFRAME\UI-GOLDICON.BLP:0|t,Can howl loudly enough to be heard for miles.,310,230,0,2,64658,0,0,4,0,0
Venomhide Ravasaur,|cFFFFD200Quest: |rThey Grow Up So Fast|n|cFFFFD200Zone: |rUn'Goro Crater,You raised this thing from a scaly pup - Mor'vek would be so proud. But he'd still make you clean up the mess it made in the corner.,311,230,4,1,64659,0,0,4,0,0
Sea Turtle,|cFFFFD200Profession:|r Fishing|n,"Often caught by fishermen at a young age, these mounts are much more comfortable in the water than they are on land.",312,231,2192,3,64731,0,0,4,0,0
Deadly Gladiator's Frost Wyrm,|cFFFFD200Legacy|r,These reanimated vessels of destruction do not fear death; they dispense it.,313,248,192,2,64927,0,0,4,0,0
Black Skeletal Horse,|cFFFFD200Vendor: |rZachariah Post|n|cFFFFD200Zone: |rTirisfal Glades|n|cFFFFD200Cost: |r1|TINTERFACE\MONEYFRAME\UI-GOLDICON.BLP:0|t,"The Forsaken believe that without a purpose, even beasts of burden suffer in undeath.",314,230,0,2,64977,0,0,4,0,0
Furious Gladiator's Frost Wyrm,|cFFFFD200Legacy|r,Some of Azeroth's mightiest dragons have been summoned across the veil between life and death to serve new masters with undying loyalty.,317,248,192,2,65439,0,0,4,0,0
Great Red Elekk,|cFFFFD200Vendor: |rIrisee|n|cFFFFD200Zone: |rIcecrown|n|cFFFFD200Cost: |r500|TINTERFACE\MONEYFRAME\UI-GOLDICON.BLP:0|t,"Never seen in Nagrand, the first red elekk calves were born in Azeroth after the Exodar's arrival. Some breeders theorize that the unique coloration is somehow caused by the same radiation which ravaged Bloodmyst Isle.",318,230,0,2,65637,0,0,45,0,0
Swift Moonsaber,|cFFFFD200Vendor: |rRook Hawkfist|n|cFFFFD200Zone: |rIcecrown|n|cFFFFD200Cost: |r500|TINTERFACE\MONEYFRAME\UI-GOLDICON.BLP:0|t,"Many night elves revere these proud mounts because their shimmering coats symbolize the goddess of the moon, Elune.",319,230,0,2,65638,0,0,4,0,0
Swift Red Hawkstrider,|cFFFFD200Vendor: |rTrellis Morningsun|n|cFFFFD200Zone: |rIcecrown|n|cFFFFD200Cost: |r500|TINTERFACE\MONEYFRAME\UI-GOLDICON.BLP:0|t,"What do you mean is it dyed? Oh, the bird. We did touch up the red just a little. -Trellis Morningsun",320,230,0,2,65639,0,0,44,0,0
Swift Gray Steed,|cFFFFD200Vendor: |rCorporal Arthur Flew|n|cFFFFD200Zone: |rIcecrown|n|cFFFFD200Cost: |r500|TINTERFACE\MONEYFRAME\UI-GOLDICON.BLP:0|t,A veteran of some of the toughest battles fought by the Argent Crusade.,321,230,0,2,65640,0,0,4,0,0
Great Golden Kodo,|cFFFFD200Vendor: |rDoru Thunderhorn|n|cFFFFD200Zone: |rIcecrown|n|cFFFFD200Cost: |r500|TINTERFACE\MONEYFRAME\UI-GOLDICON.BLP:0|t,"An alpha member of the herd, this kodo is a prime example of the mighty creatures which thunder through the Southern Barrens.",322,230,4,2,65641,0,0,4,0,0
Turbostrider,|cFFFFD200Vendor: |rRillie Spindlenut|n|cFFFFD200Zone: |rIcecrown|n|cFFFFD200Cost: |r500|TINTERFACE\MONEYFRAME\UI-GOLDICON.BLP:0|t,"The mirror's not so you can look back, but so your foes can see something besides your tailpipes. -Rillie Spindlenut",323,230,0,2,65642,0,0,4,0,0
Swift Violet Ram,|cFFFFD200Vendor: |rDerrick Brindlebeard|n|cFFFFD200Zone: |rIcecrown|n|cFFFFD200Cost: |r500|TINTERFACE\MONEYFRAME\UI-GOLDICON.BLP:0|t,The Barak Tor'ol ram's thick bony skull and massive horns make it the ideal mount for charging through groups of armored enemies.,324,230,0,2,65643,0,0,4,0,0
Swift Purple Raptor,|cFFFFD200Vendor: |rSamamba|n|cFFFFD200Zone: |rIcecrown|n|cFFFFD200Cost: |r500|TINTERFACE\MONEYFRAME\UI-GOLDICON.BLP:0|t,"Longtime allies of the trolls, these jungle hunters form a special bond with their masters. They become mount, guardian, and friend.",325,230,0,2,65644,0,0,4,0,0
White Skeletal Warhorse,|cFFFFD200Vendor: |rEliza Killian|n|cFFFFD200Zone: |rIcecrown|n|cFFFFD200Cost: |r500|TINTERFACE\MONEYFRAME\UI-GOLDICON.BLP:0|t,"When fallen heroes are raised into undeath, so too are their horses.",326,230,0,2,65645,0,0,4,0,0
Swift Burgundy Wolf,|cFFFFD200Vendor: |rFreka Bloodaxe|n|cFFFFD200Zone: |rIcecrown|n|cFFFFD200Cost: |r500|TINTERFACE\MONEYFRAME\UI-GOLDICON.BLP:0|t,"The wolves of the Horde are befriended, not domesticated.",327,230,0,2,65646,0,0,4,0,0
Magic Rooster,|cFFFFD200Vendor: |rLandro Longshot|n|cFFFFD200Location:|r Booty Bay,"Magic in the hands of a genius can do wonderful, miraculous things. Magic in the hands of an idiot can make a giant rooster.",328,230,64,8,65917,0,0,4,0,0
Silver Covenant Hippogryph,|cFFFFD200Vendor: |rHiren Loresong|n|cFFFFD200Zone: |rIcecrown|n|cFFFFD200Faction: |rThe Silver Covenant - Exalted|n|cFFFFD200Cost: |r150|TINTERFACE\ICONS\Ability_Paladin_ArtofWar.blp:0|t,"Silver Covenant Hippogryphs are fiercely loyal, both to their riding partners, and to the Alliance.",329,248,132,2,66087,0,0,4,0,0
Sunreaver Dragonhawk,|cFFFFD200Vendor: |rVasarin Redmorn|n|cFFFFD200Zone: |rIcecrown|n|cFFFFD200Faction: |rThe Sunreavers - Exalted|n|cFFFFD200Cost: |r150|Hcurrency:241|h|TInterface\ICONS\Ability_Paladin_ArtofWar.blp:0|t|h,The Sunreavers of Dalaran select only the swiftest and most formidable of dragonhawks as their mounts.,330,248,132,2,66088,0,0,4,0,0
Quel'dorei Steed,|cFFFFD200Vendor: |rHiren Loresong|n|cFFFFD200Zone: |rIcecrown|n|cFFFFD200Faction: |rThe Silver Covenant - Exalted|n|cFFFFD200Cost: |r100|TINTERFACE\ICONS\Ability_Paladin_ArtofWar.blp:0|t,Comes from a lineage of fine horses that once grazed near the shores of the Well of Eternity.,331,230,4,2,66090,0,0,4,0,0
Sunreaver Hawkstrider,|cFFFFD200Vendor: |rVasarin Redmorn|n|cFFFFD200Zone: |rIcecrown|n|cFFFFD200Faction: |rThe Sunreavers - Exalted|n|cFFFFD200Cost: |r100|Hcurrency:241|h|TInterface\ICONS\Ability_Paladin_ArtofWar.blp:0|t|h,"I demand speed, grace and discipline on the battlefield. This one will serve nicely. -Eressea Dawnsinger",332,230,4,2,66091,0,0,44,0,0
Magic Rooster,|cFFFFD200Vendor: |rLandro Longshot|n|cFFFFD200Location:|r Booty Bay,"Magic in the hands of a genius can do wonderful, miraculous things. Magic in the hands of an idiot can make a giant rooster.",333,230,64,8,66122,0,0,4,0,0
Magic Rooster,|cFFFFD200Vendor: |rLandro Longshot|n|cFFFFD200Location:|r Booty Bay,"Magic in the hands of a genius can do wonderful, miraculous things. Magic in the hands of an idiot can make a giant rooster.",334,230,64,8,66123,0,0,4,0,0
Magic Rooster,|cFFFFD200Vendor: |rLandro Longshot|n|cFFFFD200Location:|r Booty Bay,"Magic in the hands of a genius can do wonderful, miraculous things. Magic in the hands of an idiot can make a giant rooster.",335,230,64,8,66124,0,0,4,0,0
Ochre Skeletal Warhorse,|cFFFFD200Vendor: |rZachariah Post|n|cFFFFD200Zone: |rTirisfal Glades|n|cFFFFD200Cost: |r10|TINTERFACE\MONEYFRAME\UI-GOLDICON.BLP:0|t,"When fallen heroes are raised into undeath, so too are their horses.",336,230,0,2,66846,0,0,4,0,0
Striped Dawnsaber,|cFFFFD200Vendor: |rLelanai|n|cFFFFD200Zone: |rTeldrassil|n|cFFFFD200Cost: |r1|TINTERFACE\MONEYFRAME\UI-GOLDICON.BLP:0|t,Night elves once believed that seeing this light colored saber breed in the wild was an ill omen.,337,230,0,2,66847,0,0,4,0,0
Argent Charger,|cFFFFD200Vendor: |rDame Evniki Kapsalis|n|cFFFFD200Zone: |rIcecrown|n|cFFFFD200Cost: |r100|TINTERFACE\ICONS\Ability_Paladin_ArtofWar.blp:0|t|n,Trained to accept only champions of the Light as a rider.,338,230,0,2,66906,27943,0,4,0,0
Relentless Gladiator's Frost Wyrm,|cFFFFD200Legacy|r,"In life, it could not be tamed, but necromancy and esoteric binding rituals have now combined to bend this indomitable creature to its rider's will.",340,248,192,5,67336,0,0,4,0,0
Argent Warhorse,|cFFFFD200Vendor: |rDame Evniki Kapsalis|n|cFFFFD200Zone: |rIcecrown|n|cFFFFD200Cost: |r100|TINTERFACE\ICONS\Ability_Paladin_ArtofWar.blp:0|t,Given only to those who prove themselves a champion in the Argent Tournament.,341,230,0,2,67466,0,0,4,0,0
Swift Horde Wolf,|cFFFFD200Legacy|r,A few of the Argent Crusade's swiftest mounts were awarded to those members of the Horde who performed exceptionally during the tournament in Icecrown.,342,230,68,2,68056,0,0,4,0,0
Swift Alliance Steed,|cFFFFD200Legacy|r,A few of the Argent Crusade's swiftest mounts were awarded to those members of the Alliance who performed exceptionally during the tournament in Icecrown.,343,230,68,2,68057,0,0,4,0,0
Crusader's White Warhorse,|cFFFFD200Legacy|r,"Awarded to only the most skilled champions from the Trial of the Crusader, these steeds were chosen for Alliance members from Tirion Fordring's own personal stable.",344,230,68,5,68187,0,0,4,0,0
Crusader's Black Warhorse,|cFFFFD200Legacy|r,"Awarded to only the most skilled champions from the Trial of the Crusader, these steeds were chosen for Horde members from Tirion Fordring's own personal stable.",345,230,68,5,68188,0,0,4,0,0
Onyxian Drake,|cFFFFD200Drop: |rOnyxia|n|cFFFFD200Zone: |rOnyxia's Lair,"She has a lot in common with her mother, except for the being killed and reanimated. But she is young still. -Maloriak",349,248,128,0,69395,0,0,4,0,0
Sunwalker Kodo,|cFFFFD200Paladin|r,"This magnificent beast, adorned in sacred charms and painted with holy imagery, radiates with the warmth of the sun.",350,230,4,1,69820,27945,0,4,0,0
Great Sunwalker Kodo,|cFFFFD200Paladin|r,"At daybreak, the noble Sunwalkers often perform rituals to bless their mounts, imbuing them with holy magic.",351,230,4,1,69826,27945,0,4,0,0
Big Love Rocket,|cFFFFD200Drop:|r Heart-Shaped Box,Apothecary Hummel painted this masterpiece bright pink for an unrequited love.,352,248,0,0,71342,0,0,4,0,0
Wrathful Gladiator's Frost Wyrm,|cFFFFD200Legacy|r,"Many believe that during their early lives, these wyrms were forced to fight their own kind for the amusement of others. Perhaps that is why they possess a particularly combative temperament.",358,248,192,5,71810,0,0,4,0,0
Invincible,|cFFFFD200Drop: |rThe Lich King|n|cFFFFD200Zone: |rIcecrown Citadel,"The famous steed of Arthas Menethil, who serves its master in life and in death.  Riding him is truly a feat of strength.",363,248,0,0,72286,0,1.25,4,0,0
Icebound Frostbrood Vanquisher,|cFFFFD200Achievement: |rGlory of the Icecrown Raider (25 player)|n|cFFFFD200Category: |rDungeons & Raids,"Raised from the chilling depths of Icecrown, Frostbrood Vanquishers are considered among the fiercest and most relentless of all frost wyrms.",364,248,128,5,72807,0,0,4,0,0
Bloodbathed Frostbrood Vanquisher,|cFFFFD200Achievement: |rGlory of the Icecrown Raider (10 player)|n|cFFFFD200Category: |rDungeons & Raids,Bloodbathed Vanquishers are so named when it is determined that a reanimated frost wyrm died a particularly gruesome and bloody death.,365,248,128,5,72808,0,0,4,0,0
Crimson Deathcharger,|cFFFFD200Quest: |rMograine's Reunion|n|cFFFFD200Zone: |rIcecrown Citadel,Stabled in the Icecrown Citadel to serve the Lich King's most favored minions.,366,230,0,1,73313,0,0,4,0,0
Exarch's Elekk,|cFFFFD200Legacy|r,"Draenei exarchs have long marched into war atop these imposing mounts, bred for their razor-sharp tusks.",367,230,4,1,73629,27946,0,44,0,0
Great Exarch's Elekk,|cFFFFD200Quest|r |n,Only the most distinguished paladins are given the honor of riding this elekk. Its plated armor and purple adornments have been blessed by Prophet Velen himself.,368,230,4,1,73630,27946,0,44,0,0
Blazing Hippogryph,|cFFFFD200Vendor: |rLandro Longshot|n|cFFFFD200Location:|r Booty Bay,"Hippogryphs are highly intelligent, sentient beings; far more than mere ""mounts.""",371,248,192,8,74856,0,0,4,0,0
Wooly White Rhino,|cFFFFD200Vendor: |rLandro Longshot|n|cFFFFD200Location:|r Booty Bay,"Captured by Toby ""Mother Goose"" Ironbolt on the Borean Tundra, this shaggy beast carries an enormous grudge after being bridled by a gnome.",372,230,64,8,74918,0,0,4,0,0
Vashj'ir Seahorse,|cFFFFD200Quest: |rThe Abyssal Ride|n|cFFFFD200Zone: |rKelp'thar Forest,"Stubborn until broken, these underwater mounts provide the swiftest means of travel around the depths of Vashj'ir.",373,232,2064,1,75207,0,0,45,0,0
Frosty Flying Carpet,|cFFFFD200Profession: |rTailoring,"""I remember my first flying carpet... yeti hair and burlap.  Not nearly as nice as this one here."" - Frozo the Renowned",375,248,1024,3,75596,26503,0,4,0,0
Celestial Steed,|cFFFFD200In-Game Shop|r,A beacon of hope; a guiding light in the darkness.,376,248,0,9,75614,0,1.25,4,0,0
X-53 Touring Rocket,|cFFFFD200Recruit-a-Friend |r,Riding a giant cylinder filled with highly explosive goblin rocket fuel all by yourself is just crazy...so bring a friend.,382,248,0,7,75973,0,0,4,0,0
Fossilized Raptor,|cFFFFD200Profession: |rArchaeology,Legends tell of a spell placed upon a hunting raptor who dared to snarl at young Tyrande Whisperwind as she bathed in a jungle pool. The beast is cursed to wander Azeroth -  until it apologizes.,386,230,0,3,84751,0,0,4,0,0
Goblin Trike,|cFFFFD200Vendor: |rKall Worthaton|n|cFFFFD200Zone: |rOrgrimmar|n|cFFFFD200Cost: |r1|TINTERFACE\MONEYFRAME\UI-GOLDICON.BLP:0|t,"A compilation of nuts, bolts, gears, and treated wood paneling make for an unusually smooth ride.",388,230,0,2,87090,0,0,4,0,0
Goblin Turbo-Trike,|cFFFFD200Vendor: |rKall Worthaton|n|cFFFFD200Zone: |rOrgrimmar|n|cFFFFD200Cost: |r10|TINTERFACE\MONEYFRAME\UI-GOLDICON.BLP:0|t,The turbo trike's tri-wheel design adds superior stability and a smaller turn radius over its two wheeled cousins.,389,230,0,2,87091,0,0,4,0,0
